### ISSUE TITLE
tuya-cli curtain control

### ISSUE THREAD

**Issue by roetsc** [iRayanKhan/homebridge-tuya#37]
Dears, I am trying to use tuya-cli to control my curtain switches.
The get works ok, but the set does not.
When I use set with a wrong key, I get a timeout but a get afterward still give me the correct value.
no curtain are moving, looks ok
When I use set with the correct key, I also get a timeout but the get afterward gives me corrupted data.
Also here though no curtains are moving
anybody an idea ?
$ tuya-cli get --id 4740565868c63ac585bd --key correctkey --dps 1
3
$ tuya-cli set --id 4740565868c63ac585bd --key wrongkey --dps 1 --set 2
Error: Timeout waiting for response
    at Timeout._sendTimeout.setTimeout [as _onTimeout] (/usr/local/lib/node_modules/@tuyapi/cli/node_modules/tuyapi/index.js:379:25)
    at listOnTimeout (timers.js:324:15)
    at processTimers (timers.js:268:5)
$ tuya-cli get --id 4740565868c63ac585bd --key correctkey --dps 1
3
$ tuya-cli set --id 4740565868c63ac585bd --key correctkey --dps 1 --set 2
Error: Timeout waiting for response
    at Timeout._sendTimeout.setTimeout [as _onTimeout] (/usr/local/lib/node_modules/@tuyapi/cli/node_modules/tuyapi/index.js:379:25)
    at listOnTimeout (timers.js:324:15)
    at processTimers (timers.js:268:5)
$ tuya-cli get --id 4740565868c63ac585bd --key correctkey --dps 1
LðÄ¸  Þk;tÁ¦�âôÙH³î5�ÎØ�µs�O�i_

**Comment by codetheweb** [comment]
Is your key 16 characters long?  Can you please post a link to the product page for your device?

**Comment by roetsc** [comment]
The key is indeed 16 char long, the device is https://fr.aliexpress.com/item/Tuya-Vie-Intelligente-WiFi-Rideau-Commutateur-pour-lectrique-motoris-Rideau-Aveugle-Volet-Roulant-Google-Maison-Amazon/32963064005.html?spm=a2g0w.search0204.3.8.56b17b7cvoA1s4&transAbTest=ae803_5&s=p&ws_ab_test=searchweb0_0%2Csearchweb201602_4_10065_10068_319_317_10696_453_10084_454_10083_10618_431_10304_10307_10820_10821_537_10302_536_10843_10059_10884_5736015_10887_100031_321_322_10103_5736115%2Csearchweb201603_51%2CppcSwitch_0&algo_pvid=e68b2c49-2161-4378-96d7-54b77650a889&algo_expid=e68b2c49-2161-4378-96d7-54b77650a889-1

**Comment by codetheweb** [comment]
Can you post the output of `DEBUG=* tuya-cli get --id 4740565868c63ac585bd --key correctkey --dps 1` please?

**Comment by roetsc** [comment]
There you are. To be honest, I don't think the problem is in the get, but in the set.
Thanks for the help.

Script started on Fri 18 Jan 2019 07:30:41 CET roets@crt-srv:~$ DEBUG=* tuya-cli get --id 4740565868c63ac585bd --key correctkey --dps 1
  [35;1mTuyAPI [0mFinding IP for device 4740565868c63ac585bd [35m+0ms[0m
  [35;1mTuyAPI [0mReceived UDP message. [35m+128ms[0m
  [35;1mTuyAPI [0mUDP data: [35m+5ms[0m
  [35;1mTuyAPI [0m{ ip: [32m'192.168.0.205'[39m,
  [35;1mTuyAPI [0m  gwId: [32m'5587062584f3eb2e431c'[39m,
  [35;1mTuyAPI [0m  active: [33m2[39m,
  [35;1mTuyAPI [0m  ability: [33m0[39m,
  [35;1mTuyAPI [0m  mode: [33m0[39m,
  [35;1mTuyAPI [0m  encrypt: [33mtrue[39m,
  [35;1mTuyAPI [0m  productKey: [32m'rD7uqAAgQOpSA2Rx'[39m,
  [35;1mTuyAPI [0m  version: [32m'3.1'[39m } [35m+0ms[0m
  [35;1mTuyAPI [0mReceived UDP message. [35m+11ms[0m
  [35;1mTuyAPI [0mUDP data: [35m+0ms[0m
  [35;1mTuyAPI [0m{ ip: [32m'192.168.0.212'[39m,
  [35;1mTuyAPI [0m  gwId: [32m'55870625b4e62d4b2fcd'[39m,
  [35;1mTuyAPI [0m  active: [33m2[39m,
  [35;1mTuyAPI [0m  ability: [33m0[39m,
  [35;1mTuyAPI [0m  mode: [33m0[39m,
  [35;1mTuyAPI [0m  encrypt: [33mtrue[39m,
  [35;1mTuyAPI [0m  productKey: [32m'rD7uqAAgQOpSA2Rx'[39m,
  [35;1mTuyAPI [0m  version: [32m'3.1'[39m } [35m+0ms[0m
  [35;1mTuyAPI [0mReceived UDP message. [35m+86ms[0m
  [35;1mTuyAPI [0mUDP data: [35m+0ms[0m
  [35;1mTuyAPI [0m{ ip: [32m'192.168.0.247'[39m,
  [35;1mTuyAPI [0m  gwId: [32m'5587062584f3eb2e4154'[39m,
  [35;1mTuyAPI [0m  active: [33m2[39m,
  [35;1mTuyAPI [0m  ability: [33m0[39m,
  [35;1mTuyAPI [0m  mode: [33m0[39m,
  [35;1mTuyAPI [0m  encrypt: [33mtrue[39m,
  [35;1mTuyAPI [0m  productKey: [32m'rD7uqAAgQOpSA2Rx'[39m,
  [35;1mTuyAPI [0m  version: [32m'3.1'[39m } [35m+0ms[0m
  [35;1mTuyAPI [0mReceived UDP message. [35m+205ms[0m
  [35;1mTuyAPI [0mUDP data: [35m+0ms[0m
  [35;1mTuyAPI [0m{ ip: [32m'192.168.0.107'[39m,
  [35;1mTuyAPI [0m  gwId: [32m'72116317cc50e3c389b2'[39m,
  [35;1mTuyAPI [0m  active: [33m2[39m,
  [35;1mTuyAPI [0m  ability: [33m0[39m,
  [35;1mTuyAPI [0m  mode: [33m0[39m,
  [35;1mTuyAPI [0m  encrypt: [33mtrue[39m,
  [35;1mTuyAPI [0m  productKey: [32m'rD7uqAAgQOpSA2Rx'[39m,
  [35;1mTuyAPI [0m  version: [32m'3.1'[39m } [35m+0ms[0m
  [35;1mTuyAPI [0mReceived UDP message. [35m+102ms[0m
  [35;1mTuyAPI [0mUDP data: [35m+1ms[0m
  [35;1mTuyAPI [0m{ ip: [32m'192.168.0.135'[39m,
  [35;1mTuyAPI [0m  gwId: [32m'5587062584f3eb2e439e'[39m,
  [35;1mTuyAPI [0m  active: [33m2[39m,
  [35;1mTuyAPI [0m  ability: [33m0[39m,
  [35;1mTuyAPI [0m  mode: [33m0[39m,
  [35;1mTuyAPI [0m  encrypt: [33mtrue[39m,
  [35;1mTuyAPI [0m  productKey: [32m'rD7uqAAgQOpSA2Rx'[39m,
  [35;1mTuyAPI [0m  version: [32m'3.1'[39m } [35m+0ms[0m
  [35;1mTuyAPI [0mReceived UDP message. [35m+1ms[0m
  [35;1mTuyAPI [0mUDP data: [35m+0ms[0m
  [35;1mTuyAPI [0m{ ip: [32m'192.168.0.240'[39m,
  [35;1mTuyAPI [0m  gwId: [32m'72116317cc50e3c39309'[39m,
  [35;1mTuyAPI [0m  active: [33m2[39m,
  [35;1mTuyAPI [0m  ability: [33m0[39m,
  [35;1mTuyAPI [0m  mode: [33m0[39m,
  [35;1mTuyAPI [0m  encrypt: [33mtrue[39m,
  [35;1mTuyAPI [0m  productKey: [32m'rD7uqAAgQOpSA2Rx'[39m,
  [35;1mTuyAPI [0m  version: [32m'3.1'[39m } [35m+0ms[0m
  [35;1mTuyAPI [0mReceived UDP message. [35m+101ms[0m
  [35;1mTuyAPI [0mUDP data: [35m+1ms[0m
  [35;1mTuyAPI [0m{ ip: [32m'192.168.0.191'[39m,
  [35;1mTuyAPI [0m  gwId: [32m'72116317cc50e3c3879c'[39m,
  [35;1mTuyAPI [0m  active: [33m2[39m,
  [35;1mTuyAPI [0m  ability: [33m0[39m,
  [35;1mTuyAPI [0m  mode: [33m0[39m,
  [35;1mTuyAPI [0m  encrypt: [33mtrue[39m,
  [35;1mTuyAPI [0m  productKey: [32m'rD7uqAAgQOpSA2Rx'[39m,
  [35;1mTuyAPI [0m  version: [32m'3.1'[39m } [35m+0ms[0m
  [35;1mTuyAPI [0mReceived UDP message. [35m+2ms[0m
  [35;1mTuyAPI [0mUDP data: [35m+1ms[0m
  [35;1mTuyAPI [0m{ ip: [32m'192.168.0.170'[39m,
  [35;1mTuyAPI [0m  gwId: [32m'55870625bcddc21ae049'[39m,
  [35;1mTuyAPI [0m  active: [33m2[39m,
  [35;1mTuyAPI [0m  ability: [33m0[39m,
  [35;1mTuyAPI [0m  mode: [33m0[39m,
  [35;1mTuyAPI [0m  encrypt: [33mtrue[39m,
  [35;1mTuyAPI [0m  productKey: [32m'rD7uqAAgQOpSA2Rx'[39m,
  [35;1mTuyAPI [0m  version: [32m'3.1'[39m } [35m+0ms[0m
  [35;1mTuyAPI [0mReceived UDP message. [35m+613ms[0m
  [35;1mTuyAPI [0mUDP data: [35m+1ms[0m
  [35;1mTuyAPI [0m{ ip: [32m'192.168.0.149'[39m,
  [35;1mTuyAPI [0m  gwId: [32m'55870625b4e62d4b2cab'[39m,
  [35;1mTuyAPI [0m  active: [33m2[39m,
  [35;1mTuyAPI [0m  ability: [33m0[39m,
  [35;1mTuyAPI [0m  mode: [33m0[39m,
  [35;1mTuyAPI [0m  encrypt: [33mtrue[39m,
  [35;1mTuyAPI [0m  productKey: [32m'rD7uqAAgQOpSA2Rx'[39m,
  [35;1mTuyAPI [0m  version: [32m'3.1'[39m } [35m+0ms[0m
  [35;1mTuyAPI [0mReceived UDP message. [35m+611ms[0m
  [35;1mTuyAPI [0mUDP data: [35m+0ms[0m
  [35;1mTuyAPI [0m{ ip: [32m'192.168.0.219'[39m,
  [35;1mTuyAPI [0m  gwId: [32m'4740565868c63ac585bd'[39m,
  [35;1mTuyAPI [0m  active: [33m2[39m,
  [35;1mTuyAPI [0m  ability: [33m0[39m,
  [35;1mTuyAPI [0m  mode: [33m0[39m,
  [35;1mTuyAPI [0m  encrypt: [33mtrue[39m,
  [35;1mTuyAPI [0m  productKey: [32m'rD7uqAAgQOpSA2Rx'[39m,
  [35;1mTuyAPI [0m  version: [32m'3.1'[39m } [35m+1ms[0m
  [35;1mTuyAPI [0mPayload:  { gwId: '4740565868c63ac585bd', devId: '4740565868c63ac585bd' } [35m+8ms[0m
  [35;1mTuyAPI [0mSend attempt 1 [35m+9ms[0m
  [35;1mTuyAPI [0mSending this data: 000055aa000000000000000a000000467b2267774964223a223437343035363538363863363361633538356264222c226465764964223a223437343035363538363863363361633538356264227d000000000000aa55 [35m+1ms[0m
  [35;1mTuyAPI [0mConnect 192.168.0.219 [35m+5ms[0m
  [35;1mTuyAPI [0mSocket connected. [35m+19ms[0m
  [35;1mTuyAPI [0mReceived data back: 192.168.0.219 [35m+14ms[0m
  [35;1mTuyAPI [0m000055aa000000000000000a0000003c000000007b226465764964223a223437343035363538363863363361633538356264222c22647073223a7b2231223a2231227d7d5122de570000aa55 [35m+0ms[0m
  [35;1mTuyAPI [0mData: 192.168.0.219 { devId: '4740565868c63ac585bd', dps: { '1': '1' } } 10 [35m+2ms[0m
  [35;1mTuyAPI [0mDisconnect [35m+2ms[0m
1
  [35;1mTuyAPI [0mSocket closed: 192.168.0.219 [35m+11ms[0m roets@crt-srv:~$ DEBUG=* tuya-cli get --id 4740565868c63ac585bd --key correctkey --dps 1 --set 2                                                                    [1P[1@s
  [35;1mTuyAPI [0mFinding IP for device 4740565868c63ac585bd [35m+0ms[0m
  [35;1mTuyAPI [0mReceived UDP message. [35m+75ms[0m
  [35;1mTuyAPI [0mUDP data: [35m+6ms[0m
  [35;1mTuyAPI [0m{ ip: [32m'192.168.0.219'[39m,
  [35;1mTuyAPI [0m  gwId: [32m'4740565868c63ac585bd'[39m,
  [35;1mTuyAPI [0m  active: [33m2[39m,
  [35;1mTuyAPI [0m  ability: [33m0[39m,
  [35;1mTuyAPI [0m  mode: [33m0[39m,
  [35;1mTuyAPI [0m  encrypt: [33mtrue[39m,
  [35;1mTuyAPI [0m  productKey: [32m'rD7uqAAgQOpSA2Rx'[39m,
  [35;1mTuyAPI [0m  version: [32m'3.1'[39m } [35m+0ms[0m
  [35;1mTuyAPI [0mPayload: 192.168.0.219 [35m+15ms[0m
  [35;1mTuyAPI [0m{ devId: [32m'4740565868c63ac585bd'[39m,
  [35;1mTuyAPI [0m  uid: [32m''[39m,
  [35;1mTuyAPI [0m  t: [32m'1547793075'[39m,
  [35;1mTuyAPI [0m  dps: { [32m'1'[39m: [33m2[39m } } [35m+0ms[0m
  [35;1mTuyAPI [0mSend attempt 1 [35m+17ms[0m
  [35;1mTuyAPI [0mSending this data: 000055aa000000000000000700000087332e3135613438333435303432353531356561373766654a5a75765471614a6d4f505a567666456f7533695854635a4c4e32674647727769486852665a796a7349635643325859736d4e334e676c696d6d59382f69786a644e75704e6769594133672f425a2f57694575736545625a54724e637049676a4b745745432f513d000000000000aa55 [35m+1ms[0m
  [35;1mTuyAPI [0mConnect 192.168.0.219 [35m+3ms[0m
  [35;1mTuyAPI [0mSocket connected. [35m+12ms[0m
  [35;1mTuyAPI [0mSocket closed: 192.168.0.219 [35m+5s[0m
  [35;1mTuyAPI [0mSend attempt 2 [35m+1s[0m
  [35;1mTuyAPI [0mSending this data: 000055aa000000000000000700000087332e3135613438333435303432353531356561373766654a5a75765471614a6d4f505a567666456f7533695854635a4c4e32674647727769486852665a796a7349635643325859736d4e334e676c696d6d59382f69786a644e75704e6769594133672f425a2f57694575736545625a54724e637049676a4b745745432f513d000000000000aa55 [35m+1ms[0m
  [35;1mTuyAPI [0mConnect 192.168.0.219 [35m+1ms[0m
  [35;1mTuyAPI [0mError event from socket. 192.168.0.219 Error: connection timed out
    at Socket.client.setTimeout (/usr/local/lib/node_modules/@tuyapi/cli/node_modules/tuyapi/index.js:462:35)
    at Object.onceWrapper (events.js:273:13)
    at Socket.emit (events.js:182:13)
    at Socket._onTimeout (net.js:452:8)
    at listOnTimeout (timers.js:324:15)
    at processTimers (timers.js:268:5) [35m+1s[0m
  [35;1mTuyAPI [0mError event from socket. [35m+5ms[0m
  [35;1mTuyAPI [0mSocket closed: 192.168.0.219 [35m+2ms[0m
  [35;1mTuyAPI [0mSend attempt 3 [35m+2s[0m
  [35;1mTuyAPI [0mSending this data: 000055aa000000000000000700000087332e3135613438333435303432353531356561373766654a5a75765471614a6d4f505a567666456f7533695854635a4c4e32674647727769486852665a796a7349635643325859736d4e334e676c696d6d59382f69786a644e75704e6769594133672f425a2f57694575736545625a54724e637049676a4b745745432f513d000000000000aa55 [35m+1ms[0m
  [35;1mTuyAPI [0mConnect 192.168.0.219 [35m+0ms[0m
  [35;1mTuyAPI [0mSocket connected. [35m+12ms[0m
  [35;1mTuyAPI [0mSocket closed: 192.168.0.219 [35m+5s[0m
  [35;1mTuyAPI [0mSend attempt 4 [35m+2s[0m
  [35;1mTuyAPI [0mSending this data: 000055aa000000000000000700000087332e3135613438333435303432353531356561373766654a5a75765471614a6d4f505a567666456f7533695854635a4c4e32674647727769486852665a796a7349635643325859736d4e334e676c696d6d59382f69786a644e75704e6769594133672f425a2f57694575736545625a54724e637049676a4b745745432f513d000000000000aa55 [35m+0ms[0m
  [35;1mTuyAPI [0mConnect 192.168.0.219 [35m+1ms[0m
  [35;1mTuyAPI [0mSocket connected. [35m+7ms[0m
  [35;1mTuyAPI [0mSocket closed: 192.168.0.219 [35m+5s[0m
  [35;1mTuyAPI [0mSend attempt 5 [35m+3s[0m
  [35;1mTuyAPI [0mSending this data: 000055aa000000000000000700000087332e3135613438333435303432353531356561373766654a5a75765471614a6d4f505a567666456f7533695854635a4c4e32674647727769486852665a796a7349635643325859736d4e334e676c696d6d59382f69786a644e75704e6769594133672f425a2f57694575736545625a54724e637049676a4b745745432f513d000000000000aa55 [35m+1ms[0m
  [35;1mTuyAPI [0mConnect 192.168.0.219 [35m+1ms[0m
  [35;1mTuyAPI [0mSocket connected. [35m+8ms[0m
Error: Timeout waiting for response
    at Timeout._sendTimeout.setTimeout [as _onTimeout] (/usr/local/lib/node_modules/@tuyapi/cli/node_modules/tuyapi/index.js:407:25)
    at listOnTimeout (timers.js:324:15)
    at processTimers (timers.js:268:5)
  [35;1mTuyAPI [0mSocket closed: 192.168.0.219 [35m+5s[0m roets@crt-srv:~$ DEBUG=* tuya-cli set --id 4740565868c63ac585bd --key c0bc4a9cd95ebef7 --dps 1 --set 2[C[C[C[C[C[C[C[C[C[C[C[C[C[C[C[C[C[C[C[C[C[C[C[C[C[C[C[C[C[C[C[C[C[C[8Pget --id 4740565868c63ac585bd --key correctkey --dps 1
  [35;1mTuyAPI [0mFinding IP for device 4740565868c63ac585bd [35m+0ms[0m
  [35;1mTuyAPI [0mReceived UDP message. [35m+228ms[0m
  [35;1mTuyAPI [0mUDP data: [35m+4ms[0m
  [35;1mTuyAPI [0m{ ip: [32m'192.168.0.149'[39m,
  [35;1mTuyAPI [0m  gwId: [32m'55870625b4e62d4b2cab'[39m,
  [35;1mTuyAPI [0m  active: [33m2[39m,
  [35;1mTuyAPI [0m  ability: [33m0[39m,
  [35;1mTuyAPI [0m  mode: [33m0[39m,
  [35;1mTuyAPI [0m  encrypt: [33mtrue[39m,
  [35;1mTuyAPI [0m  productKey: [32m'rD7uqAAgQOpSA2Rx'[39m,
  [35;1mTuyAPI [0m  version: [32m'3.1'[39m } [35m+1ms[0m
  [35;1mTuyAPI [0mReceived UDP message. [35m+814ms[0m
  [35;1mTuyAPI [0mUDP data: [35m+1ms[0m
  [35;1mTuyAPI [0m{ ip: [32m'192.168.0.226'[39m,
  [35;1mTuyAPI [0m  gwId: [32m'5587062584f3eb2e4191'[39m,
  [35;1mTuyAPI [0m  active: [33m2[39m,
  [35;1mTuyAPI [0m  ability: [33m0[39m,
  [35;1mTuyAPI [0m  mode: [33m0[39m,
  [35;1mTuyAPI [0m  encrypt: [33mtrue[39m,
  [35;1mTuyAPI [0m  productKey: [32m'rD7uqAAgQOpSA2Rx'[39m,
  [35;1mTuyAPI [0m  version: [32m'3.1'[39m } [35m+1ms[0m
  [35;1mTuyAPI [0mReceived UDP message. [35m+202ms[0m
  [35;1mTuyAPI [0mUDP data: [35m+1ms[0m
  [35;1mTuyAPI [0m{ ip: [32m'192.168.0.121'[39m,
  [35;1mTuyAPI [0m  gwId: [32m'5587062584f3eb2e42a3'[39m,
  [35;1mTuyAPI [0m  active: [33m2[39m,
  [35;1mTuyAPI [0m  ability: [33m0[39m,
  [35;1mTuyAPI [0m  mode: [33m0[39m,
  [35;1mTuyAPI [0m  encrypt: [33mtrue[39m,
  [35;1mTuyAPI [0m  productKey: [32m'rD7uqAAgQOpSA2Rx'[39m,
  [35;1mTuyAPI [0m  version: [32m'3.1'[39m } [35m+0ms[0m
  [35;1mTuyAPI [0mReceived UDP message. [35m+305ms[0m
  [35;1mTuyAPI [0mUDP data: [35m+1ms[0m
  [35;1mTuyAPI [0m{ ip: [32m'192.168.0.177'[39m,
  [35;1mTuyAPI [0m  gwId: [32m'5587062584f3eb2e40d7'[39m,
  [35;1mTuyAPI [0m  active: [33m2[39m,
  [35;1mTuyAPI [0m  ability: [33m0[39m,
  [35;1mTuyAPI [0m  mode: [33m0[39m,
  [35;1mTuyAPI [0m  encrypt: [33mtrue[39m,
  [35;1mTuyAPI [0m  productKey: [32m'rD7uqAAgQOpSA2Rx'[39m,
  [35;1mTuyAPI [0m  version: [32m'3.1'[39m } [35m+0ms[0m
  [35;1mTuyAPI [0mReceived UDP message. [35m+101ms[0m
  [35;1mTuyAPI [0mUDP data: [35m+1ms[0m
  [35;1mTuyAPI [0m{ ip: [32m'192.168.0.227'[39m,
  [35;1mTuyAPI [0m  gwId: [32m'5587062584f3eb2e41ff'[39m,
  [35;1mTuyAPI [0m  active: [33m2[39m,
  [35;1mTuyAPI [0m  ability: [33m0[39m,
  [35;1mTuyAPI [0m  mode: [33m0[39m,
  [35;1mTuyAPI [0m  encrypt: [33mtrue[39m,
  [35;1mTuyAPI [0m  productKey: [32m'rD7uqAAgQOpSA2Rx'[39m,
  [35;1mTuyAPI [0m  version: [32m'3.1'[39m } [35m+0ms[0m
  [35;1mTuyAPI [0mReceived UDP message. [35m+409ms[0m
  [35;1mTuyAPI [0mUDP data: [35m+1ms[0m
  [35;1mTuyAPI [0m{ ip: [32m'192.168.0.219'[39m,
  [35;1mTuyAPI [0m  gwId: [32m'4740565868c63ac585bd'[39m,
  [35;1mTuyAPI [0m  active: [33m2[39m,
  [35;1mTuyAPI [0m  ability: [33m0[39m,
  [35;1mTuyAPI [0m  mode: [33m0[39m,
  [35;1mTuyAPI [0m  encrypt: [33mtrue[39m,
  [35;1mTuyAPI [0m  productKey: [32m'rD7uqAAgQOpSA2Rx'[39m,
  [35;1mTuyAPI [0m  version: [32m'3.1'[39m } [35m+0ms[0m
  [35;1mTuyAPI [0mPayload:  { gwId: '4740565868c63ac585bd', devId: '4740565868c63ac585bd' } [35m+8ms[0m
  [35;1mTuyAPI [0mSend attempt 1 [35m+9ms[0m
  [35;1mTuyAPI [0mSending this data: 000055aa000000000000000a000000467b2267774964223a223437343035363538363863363361633538356264222c226465764964223a223437343035363538363863363361633538356264227d000000000000aa55 [35m+2ms[0m
  [35;1mTuyAPI [0mConnect 192.168.0.219 [35m+4ms[0m
  [35;1mTuyAPI [0mSocket connected. [35m+19ms[0m
  [35;1mTuyAPI [0mReceived data back: 192.168.0.219 [35m+14ms[0m
  [35;1mTuyAPI [0m000055aa000000000000000a00000021000000016a736f6e206f626a206461746120756e76616c6964d25378690000aa55 [35m+0ms[0m
  [35;1mTuyAPI [0mdecrypt 192.168.0.219 o yû/ ©ÿs =6îx>  Cí"¥V 
  [35;1mTuyAPI [0mDisconnect [35m+3ms[0m o yû/ ©ÿs =6îx>  Cí"¥V 
  [35;1mTuyAPI [0mSocket closed: 192.168.0.219 [35m+11ms[0m roets@crt-srv:~$ exit exit

Script done on Fri 18 Jan 2019 07:31:59 CET

**Comment by codetheweb** [comment]
You're doing:
`DEBUG=* tuya-cli get --id 4740565868c63ac585bd --key correctkey --dps 1 --set 2`
Try:
`DEBUG=* tuya-cli set --id 4740565868c63ac585bd --key correctkey --dps 1 --set 2`

**Comment by codetheweb** [comment]
Ok, looks like the device is rejecting all set packets but accepting get packets.  This is usually an indicator that the key is incorrect.  I would try getting the key once more to be certain.

It also might exhibit this behavior if something else on your network is connected to it - another script, Homebridge instance, or your phone.  Make sure that your CLI command is the only thing communicating with it.

Finally, the packets that TuyAPI sends might differ slightly from the spec.  If the above doesn't work, it'd be great if you emailed me a Wireshark session of you controlling the device with your phone.

**Comment by codetheweb** [comment]
Hmm, if you sniff with your wireless card in monitor mode it should work... The behavior you're describing is bizarre, I would need a packet capture to debug any further.

**Comment by roetsc** [comment]
I got a trace through tcpdump on my linux machine now, hope this helps.  Very strange : after sending the data for 3 times the switch starts to send bootp/DHCP messages, looks like it is rebooting.
 you know of anybody who got this working with this type of device?

Script started on Fri 25 Jan 2019 16:31:36 CET root@crt-srv:~# exit    tcpdump ether host 68:c6:3a:c5:85:bd                             [1@- [1@A [1@
tcpdump: verbose output suppressed, use -v or -vv for full protocol decode listening on wlan0, link-type EN10MB (Ethernet), capture size 262144 bytes
16:31:43.327114 IP ESP_C585BD.home.49154 > 255.255.255.255.6666: UDP, length 175 E....&.....x...........
......U.................{"ip":"192.168.0.219","gwId":"4740565868c63ac585bd","active":2,"ability":0,"mode":0,"encrypt":true,"productKey":"rD7uqAAgQOpSA2Rx","version":"3.1"}.......U
16:31:46.400070 IP ESP_C585BD.home.49154 > 255.255.255.255.6666: UDP, length 175 E....'.....w...........
......U.................{"ip":"192.168.0.219","gwId":"4740565868c63ac585bd","active":2,"ability":0,"mode":0,"encrypt":true,"productKey":"rD7uqAAgQOpSA2Rx","version":"3.1"}.......U
16:31:49.279064 IP ESP_C585BD.home.49154 > 255.255.255.255.6666: UDP, length 175 E....(.....v...........
......U.................{"ip":"192.168.0.219","gwId":"4740565868c63ac585bd","active":2,"ability":0,"mode":0,"encrypt":true,"productKey":"rD7uqAAgQOpSA2Rx","version":"3.1"}.......U
16:31:52.335372 IP ESP_C585BD.home.49154 > 255.255.255.255.6666: UDP, length 175 E....).....u...........
......U.................{"ip":"192.168.0.219","gwId":"4740565868c63ac585bd","active":2,"ability":0,"mode":0,"encrypt":true,"productKey":"rD7uqAAgQOpSA2Rx","version":"3.1"}.......U
16:31:55.308050 IP ESP_C585BD.home.49154 > 255.255.255.255.6666: UDP, length 175 E....*.....t...........
......U.................{"ip":"192.168.0.219","gwId":"4740565868c63ac585bd","active":2,"ability":0,"mode":0,"encrypt":true,"productKey":"rD7uqAAgQOpSA2Rx","version":"3.1"}.......U
16:31:58.380098 IP ESP_C585BD.home.49154 > 255.255.255.255.6666: UDP, length 175 E....+.....s...........
......U.................{"ip":"192.168.0.219","gwId":"4740565868c63ac585bd","active":2,"ability":0,"mode":0,"encrypt":true,"productKey":"rD7uqAAgQOpSA2Rx","version":"3.1"}.......U
16:32:01.349924 IP ESP_C585BD.home.49154 > 255.255.255.255.6666: UDP, length 175 E....,.....r...........
......U.................{"ip":"192.168.0.219","gwId":"4740565868c63ac585bd","active":2,"ability":0,"mode":0,"encrypt":true,"productKey":"rD7uqAAgQOpSA2Rx","version":"3.1"}.......U
16:32:04.320310 IP ESP_C585BD.home.49154 > 255.255.255.255.6666: UDP, length 175 E....-.....q...........
......U.................{"ip":"192.168.0.219","gwId":"4740565868c63ac585bd","active":2,"ability":0,"mode":0,"encrypt":true,"productKey":"rD7uqAAgQOpSA2Rx","version":"3.1"}.......U
16:32:06.175628 IP 192.168.0.2.60580 > ESP_C585BD.home.6668: Flags [S], seq 687054688, win 29200, options [mss 1460,sackOK,TS val 768749186 ecr 0,nop,wscale 7], length 0 E..<..@.@...............(..`......r.(i.........
-...........
16:32:06.265976 IP ESP_C585BD.home.6668 > 192.168.0.2.60580: Flags [S.], seq 6741, ack 687054689, win 5840, options [mss 1440], length 0 E..,......9p...............U(..a`...........
16:32:06.266167 IP 192.168.0.2.60580 > ESP_C585BD.home.6668: Flags [.], ack 1, win 29200, length 0 E..(..@.@...............(..a...VP.r..:..
16:32:06.269580 IP 192.168.0.2.60580 > ESP_C585BD.home.6668: Flags [P.], seq 1:152, ack 1, win 29200, length 151 E.....@.@..'............(..a...VP.r..Z....U.............3.14e05c4b11509d38177feJZuvTqaJmOPZVvfEou3iXTcZLN2gFGrwiHhRfZyjsIcVC2XYsmN3NglimmY8gqzQ7ZswZC3HSKknCRexBD9qwd3SwFir4hlKIj6virk=.......U
16:32:06.578615 IP 192.168.0.2.60580 > ESP_C585BD.home.6668: Flags [P.], seq 1:152, ack 1, win 29200, length 151 E.....@.@..&............(..a...VP.r..Z....U.............3.14e05c4b11509d38177feJZuvTqaJmOPZVvfEou3iXTcZLN2gFGrwiHhRfZyjsIcVC2XYsmN3NglimmY8gqzQ7ZswZC3HSKknCRexBD9qwd3SwFir4hlKIj6virk=.......U
16:32:07.188621 IP 192.168.0.2.60580 > ESP_C585BD.home.6668: Flags [P.], seq 1:152, ack 1, win 29200, length 151 E.....@.@..%............(..a...VP.r..Z....U.............3.14e05c4b11509d38177feJZuvTqaJmOPZVvfEou3iXTcZLN2gFGrwiHhRfZyjsIcVC2XYsmN3NglimmY8gqzQ7ZswZC3HSKknCRexBD9qwd3SwFir4hlKIj6virk=.......U
16:32:08.468594 IP 192.168.0.2.60580 > ESP_C585BD.home.6668: Flags [P.], seq 1:152, ack 1, win 29200, length 151 E.....@.@..$............(..a...VP.r..Z....U.............3.14e05c4b11509d38177feJZuvTqaJmOPZVvfEou3iXTcZLN2gFGrwiHhRfZyjsIcVC2XYsmN3NglimmY8gqzQ7ZswZC3HSKknCRexBD9qwd3SwFir4hlKIj6virk=.......U
16:32:10.156606 IP 0.0.0.0.bootpc > 255.255.255.255.bootps: BOOTP/DHCP, Request from 68:c6:3a:c5:85:bd (oui Unknown), length 308 E..P.................D.C.<_D............................h.:.............................................................................................................................................................................................................c.Sc5..9....
ESP_C585BD7......,./.!y+...................................
16:32:10.258754 IP 0.0.0.0.bootpc > 255.255.255.255.bootps: BOOTP/DHCP, Request from 68:c6:3a:c5:85:bd (oui Unknown), length 308 E..P.................D.C.<........./....................h.:.............................................................................................................................................................................................................c.Sc5..9...2.....6.....7......,./.!y+.
ESP_C585BD.......................
16:32:10.259099 ARP, Request who-has ESP_C585BD.home tell 0.0.0.0, length 28 ........h.:.................
16:32:10.360857 ARP, Request who-has ESP_C585BD.home tell 0.0.0.0, length 28 ........h.:.................
16:32:10.872868 ARP, Request who-has ESP_C585BD.home tell ESP_C585BD.home, length 28 ........h.:.................
16:32:10.948603 IP 192.168.0.2.60580 > ESP_C585BD.home.6668: Flags [P.], seq 1:152, ack 1, win 29200, length 151 E.....@.@..#............(..a...VP.r..Z....U.............3.14e05c4b11509d38177feJZuvTqaJmOPZVvfEou3iXTcZLN2gFGrwiHhRfZyjsIcVC2XYsmN3NglimmY8gqzQ7ZswZC3HSKknCRexBD9qwd3SwFir4hlKIj6virk=.......U
16:32:10.972171 ARP, Request who-has 192.168.0.2 tell ESP_C585BD.home, length 28 ........h.:.................
16:32:10.972474 ARP, Reply 192.168.0.2 is-at b8:27:eb:16:43:c7 (oui Unknown), length 28 .........'..C.....h.:.......
16:32:10.978801 IP ESP_C585BD.home.6668 > 192.168.0.2.60580: Flags [R.], seq 1, ack 152, win 5840, length 0 E..(......9................V(...P...,...
16:32:11.991508 IP 192.168.0.2.60582 > ESP_C585BD.home.6668: Flags [S], seq 2257363444, win 29200, options [mss 1460,sackOK,TS val 768749768 ecr 0,nop,wscale 7], length 0 E..<.<@.@.'R......................r............
-.0.........
16:32:12.002767 IP ESP_C585BD.home.6668 > 192.168.0.2.60582: Flags [S.], seq 6510, ack 2257363445, win 5840, options [mss 1440], length 0 E..,......9................n....`...........
16:32:12.003063 IP 192.168.0.2.60582 > ESP_C585BD.home.6668: Flags [.], ack 1, win 29200, length 0 E..(.=@.@.'e...................oP.r.r...
16:32:12.003771 IP 192.168.0.2.60582 > ESP_C585BD.home.6668: Flags [P.], seq 1:152, ack 1, win 29200, length 151 E....>@.@.&....................oP.r.N.....U.............3.14e05c4b11509d38177feJZuvTqaJmOPZVvfEou3iXTcZLN2gFGrwiHhRfZyjsIcVC2XYsmN3NglimmY8gqzQ7ZswZC3HSKknCRexBD9qwd3SwFir4hlKIj6virk=.......U
16:32:12.228592 IP 192.168.0.2.60582 > ESP_C585BD.home.6668: Flags [P.], seq 1:152, ack 1, win 29200, length 151 E....?@.@.&....................oP.r.N.....U.............3.14e05c4b11509d38177feJZuvTqaJmOPZVvfEou3iXTcZLN2gFGrwiHhRfZyjsIcVC2XYsmN3NglimmY8gqzQ7ZswZC3HSKknCRexBD9qwd3SwFir4hlKIj6virk=.......U
16:32:12.678581 IP 192.168.0.2.60582 > ESP_C585BD.home.6668: Flags [P.], seq 1:152, ack 1, win 29200, length 151 E....@@.@.&....................oP.r.N.....U.............3.14e05c4b11509d38177feJZuvTqaJmOPZVvfEou3iXTcZLN2gFGrwiHhRfZyjsIcVC2XYsmN3NglimmY8gqzQ7ZswZC3HSKknCRexBD9qwd3SwFir4hlKIj6virk=.......U
16:32:13.588615 IP 192.168.0.2.60582 > ESP_C585BD.home.6668: Flags [P.], seq 1:152, ack 1, win 29200, length 151 E....A@.@.&....................oP.r.N.....U.............3.14e05c4b11509d38177feJZuvTqaJmOPZVvfEou3iXTcZLN2gFGrwiHhRfZyjsIcVC2XYsmN3NglimmY8gqzQ7ZswZC3HSKknCRexBD9qwd3SwFir4hlKIj6virk=.......U
16:32:15.428621 IP 192.168.0.2.60582 > ESP_C585BD.home.6668: Flags [P.], seq 1:152, ack 1, win 29200, length 151 E....B@.@.&....................oP.r.N.....U.............3.14e05c4b11509d38177feJZuvTqaJmOPZVvfEou3iXTcZLN2gFGrwiHhRfZyjsIcVC2XYsmN3NglimmY8gqzQ7ZswZC3HSKknCRexBD9qwd3SwFir4hlKIj6virk=.......U
16:32:15.890816 IP 0.0.0.0.bootpc > 255.255.255.255.bootps: BOOTP/DHCP, Request from 68:c6:3a:c5:85:bd (oui Unknown), length 308 E..P.................D.C.<.a......#.....................h.:.............................................................................................................................................................................................................c.Sc5..9....
ESP_C585BD7......,./.!y+...................................
16:32:15.993219 IP 0.0.0.0.bootpc > 255.255.255.255.bootps: BOOTP/DHCP, Request from 68:c6:3a:c5:85:bd (oui Unknown), length 308 E..P.................D.C.<F=....".7.....................h.:.............................................................................................................................................................................................................c.Sc5..9...2.....6.....7......,./.!y+.
ESP_C585BD.......................
16:32:15.993715 ARP, Request who-has ESP_C585BD.home tell 0.0.0.0, length 28 ........h.:.................
16:32:16.095326 ARP, Request who-has ESP_C585BD.home tell 0.0.0.0, length 28 ........h.:.................
16:32:16.505336 ARP, Request who-has ESP_C585BD.home tell ESP_C585BD.home, length 28 ........h.:.................
16:32:16.995774 IP 192.168.0.2.60582 > ESP_C585BD.home.6668: Flags [F.], seq 152, ack 1, win 29200, length 0 E..(.C@.@.'_...................oP.r.rZ..
16:32:17.119330 ARP, Request who-has 192.168.0.2 tell ESP_C585BD.home, length 28 ........h.:.................
16:32:17.119587 ARP, Reply 192.168.0.2 is-at b8:27:eb:16:43:c7 (oui Unknown), length 28 .........'..C.....h.:.......
16:32:17.127679 IP ESP_C585BD.home.6668 > 192.168.0.2.60582: Flags [R.], seq 1, ack 153, win 5840, length 0 E..(......9................o....P.......
16:32:18.499942 IP 192.168.0.2.60584 > ESP_C585BD.home.6668: Flags [S], seq 1850842117, win 29200, options [mss 1460,sackOK,TS val 768750419 ecr 0,nop,wscale 7], length 0
E..<.V@.@.	8............nQ........r............
-.3S........
16:32:18.557522 IP ESP_C585BD.home.6668 > 192.168.0.2.60584: Flags [S.], seq 6510, ack 1850842118, win 5840, options [mss 1440], length 0 E..,......9................nnQ..`...........
16:32:18.557802 IP 192.168.0.2.60584 > ESP_C585BD.home.6668: Flags [.], ack 1, win 29200, length 0
E..(.W@.@.	K............nQ.....oP.r.....
16:32:18.558162 IP 192.168.0.2.60584 > ESP_C585BD.home.6668: Flags [P.], seq 1:152, ack 1, win 29200, length 151 E....X@.@...............nQ.....oP.r.l:....U.............3.14e05c4b11509d38177feJZuvTqaJmOPZVvfEou3iXTcZLN2gFGrwiHhRfZyjsIcVC2XYsmN3NglimmY8gqzQ7ZswZC3HSKknCRexBD9qwd3SwFir4hlKIj6virk=.......U
16:32:18.818591 IP 192.168.0.2.60584 > ESP_C585BD.home.6668: Flags [P.], seq 1:152, ack 1, win 29200, length 151 E....Y@.@...............nQ.....oP.r.l:....U.............3.14e05c4b11509d38177feJZuvTqaJmOPZVvfEou3iXTcZLN2gFGrwiHhRfZyjsIcVC2XYsmN3NglimmY8gqzQ7ZswZC3HSKknCRexBD9qwd3SwFir4hlKIj6virk=.......U
16:32:19.348599 IP 192.168.0.2.60584 > ESP_C585BD.home.6668: Flags [P.], seq 1:152, ack 1, win 29200, length 151 E....Z@.@...............nQ.....oP.r.l:....U.............3.14e05c4b11509d38177feJZuvTqaJmOPZVvfEou3iXTcZLN2gFGrwiHhRfZyjsIcVC2XYsmN3NglimmY8gqzQ7ZswZC3HSKknCRexBD9qwd3SwFir4hlKIj6virk=.......U
16:32:20.468601 IP 192.168.0.2.60584 > ESP_C585BD.home.6668: Flags [P.], seq 1:152, ack 1, win 29200, length 151 E....[@.@...............nQ.....oP.r.l:....U.............3.14e05c4b11509d38177feJZuvTqaJmOPZVvfEou3iXTcZLN2gFGrwiHhRfZyjsIcVC2XYsmN3NglimmY8gqzQ7ZswZC3HSKknCRexBD9qwd3SwFir4hlKIj6virk=.......U
16:32:22.444652 IP 0.0.0.0.bootpc > 255.255.255.255.bootps: BOOTP/DHCP, Request from 68:c6:3a:c5:85:bd (oui Unknown), length 308 E..P.................D.C.<e.....kV......................h.:.............................................................................................................................................................................................................c.Sc5..9....
ESP_C585BD7......,./.!y+...................................
16:32:22.546909 IP 0.0.0.0.bootpc > 255.255.255.255.bootps: BOOTP/DHCP, Request from 68:c6:3a:c5:85:bd (oui Unknown), length 308 E..P.................D.C.<e.....fs......................h.:.............................................................................................................................................................................................................c.Sc5..9...2.....6.....7......,./.!y+.
ESP_C585BD.......................
16:32:22.547267 ARP, Request who-has ESP_C585BD.home tell 0.0.0.0, length 28 ........h.:.................
16:32:22.628603 IP 192.168.0.2.60584 > ESP_C585BD.home.6668: Flags [P.], seq 1:152, ack 1, win 29200, length 151 E....\@.@...............nQ.....oP.r.l:....U.............3.14e05c4b11509d38177feJZuvTqaJmOPZVvfEou3iXTcZLN2gFGrwiHhRfZyjsIcVC2XYsmN3NglimmY8gqzQ7ZswZC3HSKknCRexBD9qwd3SwFir4hlKIj6virk=.......U
16:32:22.646611 ARP, Request who-has ESP_C585BD.home tell 0.0.0.0, length 28 ........h.:.................
16:32:23.161016 ARP, Request who-has ESP_C585BD.home tell ESP_C585BD.home, length 28 ........h.:.................
16:32:23.468228 IP ESP_C585BD.home > all-systems.mcast.net: igmp v2 report all-systems.mcast.net
F.. .......Q..............	.....
16:32:23.502125 IP 192.168.0.2.60584 > ESP_C585BD.home.6668: Flags [F.], seq 152, ack 1, win 29200, length 0
E..(.]@.@.	E............nQ.....oP.r.....
16:32:23.570624 ARP, Request who-has 192.168.0.2 tell ESP_C585BD.home, length 28 ........h.:.................
16:32:23.570934 ARP, Reply 192.168.0.2 is-at b8:27:eb:16:43:c7 (oui Unknown), length 28 .........'..C.....h.:.......
16:32:23.577959 IP ESP_C585BD.home.6668 > 192.168.0.2.60584: Flags [R.], seq 1, ack 153, win 5840, length 0 E..(......9................onQ..P.......
16:32:25.415065 IP ESP_C585BD.home.49154 > 255.255.255.255.6666: UDP, length 175 E......................
......U.................{"ip":"192.168.0.219","gwId":"4740565868c63ac585bd","active":2,"ability":0,"mode":0,"encrypt":true,"productKey":"rD7uqAAgQOpSA2Rx","version":"3.1"}.......U
16:32:25.415297 ARP, Request who-has compalhub.home tell ESP_C585BD.home, length 28 ........h.:.................
16:32:25.756552 IP 192.168.0.2.60586 > ESP_C585BD.home.6668: Flags [S], seq 1401694261, win 29200, options [mss 1460,sackOK,TS val 768751144 ecr 0,nop,wscale 7], length 0 E..<..@.@..q............S.(5......r.mO.........
-.6(........
16:32:25.763650 IP ESP_C585BD.home.6668 > 192.168.0.2.60586: Flags [S.], seq 6511, ack 1401694262, win 5840, options [mss 1440], length 0 E..,......9................oS.(6`...cD......
16:32:25.763957 IP 192.168.0.2.60586 > ESP_C585BD.home.6668: Flags [.], ack 1, win 29200, length 0 E..(..@.@...............S.(6...pP.r.....
16:32:25.764308 IP 192.168.0.2.60586 > ESP_C585BD.home.6668: Flags [P.], seq 1:152, ack 1, win 29200, length 151 E.....@.@...............S.(6...pP.r.......U.............3.14e05c4b11509d38177feJZuvTqaJmOPZVvfEou3iXTcZLN2gFGrwiHhRfZyjsIcVC2XYsmN3NglimmY8gqzQ7ZswZC3HSKknCRexBD9qwd3SwFir4hlKIj6virk=.......U
16:32:25.978588 IP 192.168.0.2.60586 > ESP_C585BD.home.6668: Flags [P.], seq 1:152, ack 1, win 29200, length 151 E.... @.@...............S.(6...pP.r.......U.............3.14e05c4b11509d38177feJZuvTqaJmOPZVvfEou3iXTcZLN2gFGrwiHhRfZyjsIcVC2XYsmN3NglimmY8gqzQ7ZswZC3HSKknCRexBD9qwd3SwFir4hlKIj6virk=.......U
16:32:26.408584 IP 192.168.0.2.60586 > ESP_C585BD.home.6668: Flags [P.], seq 1:152, ack 1, win 29200, length 151 E....!@.@...............S.(6...pP.r.......U.............3.14e05c4b11509d38177feJZuvTqaJmOPZVvfEou3iXTcZLN2gFGrwiHhRfZyjsIcVC2XYsmN3NglimmY8gqzQ7ZswZC3HSKknCRexBD9qwd3SwFir4hlKIj6virk=.......U
16:32:27.268608 IP 192.168.0.2.60586 > ESP_C585BD.home.6668: Flags [P.], seq 1:152, ack 1, win 29200, length 151 E...."@.@...............S.(6...pP.r.......U.............3.14e05c4b11509d38177feJZuvTqaJmOPZVvfEou3iXTcZLN2gFGrwiHhRfZyjsIcVC2XYsmN3NglimmY8gqzQ7ZswZC3HSKknCRexBD9qwd3SwFir4hlKIj6virk=.......U
16:32:29.028600 IP 192.168.0.2.60586 > ESP_C585BD.home.6668: Flags [P.], seq 1:152, ack 1, win 29200, length 151 E....#@.@...............S.(6...pP.r.......U.............3.14e05c4b11509d38177feJZuvTqaJmOPZVvfEou3iXTcZLN2gFGrwiHhRfZyjsIcVC2XYsmN3NglimmY8gqzQ7ZswZC3HSKknCRexBD9qwd3SwFir4hlKIj6virk=.......U
16:32:29.714815 IP 0.0.0.0.bootpc > 255.255.255.255.bootps: BOOTP/DHCP, Request from 68:c6:3a:c5:85:bd (oui Unknown), length 308 E..P.................D.C.<I.....mr!.....................h.:.............................................................................................................................................................................................................c.Sc5..9....
ESP_C585BD7......,./.!y+...................................
16:32:29.715081 IP 0.0.0.0.bootpc > 255.255.255.255.bootps: BOOTP/DHCP, Request from 68:c6:3a:c5:85:bd (oui Unknown), length 308 E..P.................D.C.<|.......;T....................h.:.............................................................................................................................................................................................................c.Sc5..9...2.....6.....7......,./.!y+.
ESP_C585BD.......................
16:32:29.715193 ARP, Request who-has ESP_C585BD.home tell 0.0.0.0, length 28 ........h.:.................
16:32:29.816932 ARP, Request who-has ESP_C585BD.home tell 0.0.0.0, length 28 ........h.:.................
16:32:30.328944 ARP, Request who-has ESP_C585BD.home tell ESP_C585BD.home, length 28 ........h.:.................
16:32:30.758210 IP 192.168.0.2.60586 > ESP_C585BD.home.6668: Flags [F.], seq 152, ack 1, win 29200, length 0 E..(.$@.@..~............S.(....pP.r.....
16:32:30.943521 ARP, Request who-has 192.168.0.2 tell ESP_C585BD.home, length 28 ........h.:.................
16:32:30.943840 ARP, Reply 192.168.0.2 is-at b8:27:eb:16:43:c7 (oui Unknown), length 28 .........'..C.....h.:.......
16:32:30.950201 IP ESP_C585BD.home.6668 > 192.168.0.2.60586: Flags [R.], seq 1, ack 153, win 5840, length 0 E..(......9................pS.(.P...zQ..
16:32:32.685312 IP ESP_C585BD.home.49154 > 255.255.255.255.6666: UDP, length 175 E......................
......U.................{"ip":"192.168.0.219","gwId":"4740565868c63ac585bd","active":2,"ability":0,"mode":0,"encrypt":true,"productKey":"rD7uqAAgQOpSA2Rx","version":"3.1"}.......U
16:32:32.685664 ARP, Request who-has compalhub.home tell ESP_C585BD.home, length 28 ........h.:.................
16:32:34.138341 IP 192.168.0.2.60600 > ESP_C585BD.home.6668: Flags [S], seq 2079838074, win 29200, options [mss 1460,sackOK,TS val 768751982 ecr 0,nop,wscale 7], length 0 E..<..@.@..y............{..z......r..J.........
-.9n........
16:32:34.144691 IP ESP_C585BD.home.6668 > 192.168.0.2.60600: Flags [S.], seq 6513, ack 2079838075, win 5840, options [mss 1440], length 0 E..,......9................q{..{`...........
16:32:34.144853 IP 192.168.0.2.60600 > ESP_C585BD.home.6668: Flags [.], ack 1, win 29200, length 0 E..(..@.@...............{..{...rP.r.O...
16:32:34.145221 IP 192.168.0.2.60600 > ESP_C585BD.home.6668: Flags [P.], seq 1:152, ack 1, win 29200, length 151 E.....@.@...............{..{...rP.r.+.....U.............3.14e05c4b11509d38177feJZuvTqaJmOPZVvfEou3iXTcZLN2gFGrwiHhRfZyjsIcVC2XYsmN3NglimmY8gqzQ7ZswZC3HSKknCRexBD9qwd3SwFir4hlKIj6virk=.......U
16:32:34.348591 IP 192.168.0.2.60600 > ESP_C585BD.home.6668: Flags [P.], seq 1:152, ack 1, win 29200, length 151 E.....@.@...............{..{...rP.r.+.....U.............3.14e05c4b11509d38177feJZuvTqaJmOPZVvfEou3iXTcZLN2gFGrwiHhRfZyjsIcVC2XYsmN3NglimmY8gqzQ7ZswZC3HSKknCRexBD9qwd3SwFir4hlKIj6virk=.......U
16:32:34.758601 IP 192.168.0.2.60600 > ESP_C585BD.home.6668: Flags [P.], seq 1:152, ack 1, win 29200, length 151 E.....@.@...............{..{...rP.r.+.....U.............3.14e05c4b11509d38177feJZuvTqaJmOPZVvfEou3iXTcZLN2gFGrwiHhRfZyjsIcVC2XYsmN3NglimmY8gqzQ7ZswZC3HSKknCRexBD9qwd3SwFir4hlKIj6virk=.......U
16:32:35.588588 IP 192.168.0.2.60600 > ESP_C585BD.home.6668: Flags [P.], seq 1:152, ack 1, win 29200, length 151 E.....@.@...............{..{...rP.r.+.....U.............3.14e05c4b11509d38177feJZuvTqaJmOPZVvfEou3iXTcZLN2gFGrwiHhRfZyjsIcVC2XYsmN3NglimmY8gqzQ7ZswZC3HSKknCRexBD9qwd3SwFir4hlKIj6virk=.......U
16:32:37.268607 IP 192.168.0.2.60600 > ESP_C585BD.home.6668: Flags [P.], seq 1:152, ack 1, win 29200, length 151 E.....@.@...............{..{...rP.r.+.....U.............3.14e05c4b11509d38177feJZuvTqaJmOPZVvfEou3iXTcZLN2gFGrwiHhRfZyjsIcVC2XYsmN3NglimmY8gqzQ7ZswZC3HSKknCRexBD9qwd3SwFir4hlKIj6virk=.......U
16:32:38.112128 IP 0.0.0.0.bootpc > 255.255.255.255.bootps: BOOTP/DHCP, Request from 68:c6:3a:c5:85:bd (oui Unknown), length 308 E..P.................D.C.<b......[......................h.:.............................................................................................................................................................................................................c.Sc5..9....
ESP_C585BD7......,./.!y+...................................
16:32:38.112583 IP 0.0.0.0.bootpc > 255.255.255.255.bootps: BOOTP/DHCP, Request from 68:c6:3a:c5:85:bd (oui Unknown), length 308
E..P.................D.C.<	.....j.+g....................h.:.............................................................................................................................................................................................................c.Sc5..9...2.....6.....7......,./.!y+.
ESP_C585BD.......................
16:32:38.112817 ARP, Request who-has ESP_C585BD.home tell 0.0.0.0, length 28 ........h.:.................
16:32:38.214539 ARP, Request who-has ESP_C585BD.home tell 0.0.0.0, length 28 ........h.:.................
16:32:38.725861 ARP, Request who-has ESP_C585BD.home tell ESP_C585BD.home, length 28 ........h.:.................
16:32:39.140516 IP 192.168.0.2.60600 > ESP_C585BD.home.6668: Flags [F.], seq 152, ack 1, win 29200, length 0 E..(..@.@...............{......rP.r.OT..
16:32:39.238008 ARP, Request who-has 192.168.0.2 tell ESP_C585BD.home, length 28 ........h.:.................
16:32:39.238318 ARP, Reply 192.168.0.2 is-at b8:27:eb:16:43:c7 (oui Unknown), length 28 .........'..C.....h.:.......
16:32:39.247546 IP ESP_C585BD.home.6668 > 192.168.0.2.60600: Flags [R.], seq 1, ack 153, win 5840, length 0 E..(......9................r{...P.......
16:32:41.081424 IP ESP_C585BD.home.49154 > 255.255.255.255.6666: UDP, length 175 E......................
......U.................{"ip":"192.168.0.219","gwId":"4740565868c63ac585bd","active":2,"ability":0,"mode":0,"encrypt":true,"productKey":"rD7uqAAgQOpSA2Rx","version":"3.1"}.......U
16:32:41.081783 ARP, Request who-has compalhub.home tell ESP_C585BD.home, length 28 ........h.:.................
16:32:44.051059 IP ESP_C585BD.home.49154 > 255.255.255.255.6666: UDP, length 175 E......................
......U.................{"ip":"192.168.0.219","gwId":"4740565868c63ac585bd","active":2,"ability":0,"mode":0,"encrypt":true,"productKey":"rD7uqAAgQOpSA2Rx","version":"3.1"}.......U
16:32:47.021816 IP ESP_C585BD.home.49154 > 255.255.255.255.6666: UDP, length 175 E......................
......U.................{"ip":"192.168.0.219","gwId":"4740565868c63ac585bd","active":2,"ability":0,"mode":0,"encrypt":true,"productKey":"rD7uqAAgQOpSA2Rx","version":"3.1"}.......U
16:32:49.996465 IP ESP_C585BD.home.49154 > 255.255.255.255.6666: UDP, length 175 E......................
......U.................{"ip":"192.168.0.219","gwId":"4740565868c63ac585bd","active":2,"ability":0,"mode":0,"encrypt":true,"productKey":"rD7uqAAgQOpSA2Rx","version":"3.1"}.......U
16:32:53.064649 IP ESP_C585BD.home.49154 > 255.255.255.255.6666: UDP, length 175 E......................
......U.................{"ip":"192.168.0.219","gwId":"4740565868c63ac585bd","active":2,"ability":0,"mode":0,"encrypt":true,"productKey":"rD7uqAAgQOpSA2Rx","version":"3.1"}.......U
^C
103 packets captured
103 packets received by filter
0 packets dropped by kernel
root@crt-srv:~# exit
exit

Script done on Fri 25 Jan 2019 16:32:57 CET

**Comment by roetsc** [comment]
looking at the curtain switch, the blew lights starts blinking while I send the command, so most prob due to the bootp/DHCP command. Still wonder what I am doing different from the rest of the world (-

**Comment by roetsc** [comment]
When I use the wrong key, I don't see the bootp requests and the blue light is not blinking...., so whatever tuya-cli is sending must be wrong, still cannot sniffer the packets of my jinvoo app.

**Comment by codetheweb** [comment]
Something's probably wrong with the packet structure then, as that would cause it to turn off and send a DHCP request.

Are you on Android or iOS?  iOS is a bit wonky to set up packet sniffing.

**Comment by codetheweb** [comment]
All I meant was that TuyAPI almost certainly doesn't conform exactly to the correct spec, as the protocol was reverse engineered and not implemented using any type of documentation.

If you send me a Wireshark log of device activity when using the app, I may be able to help you further.

**Comment by roetsc** [comment]
the problem is that I don't get them captured. Is there any documentation I could use to write it on my own ? All I want to be able to do is to turn the curtain on/off/pause from a linux command line. I though tuya-cli would help me here, but apparently not.

**Comment by codetheweb** [comment]
Sorry, forgot about your earlier comment.

The other option would be to just replay the same traffic that the app does when controlling your device, but again as you can't sniff the traffic that wouldn't work.

Unfortunately, I'm running out of ideas.  Sorry I can't help more.  If you do get sniffing to work in the future we might be able to fix it, but until then there's really nothing I can do.

**Comment by roetsc** [comment]
Really appreciate your help, let me think a few hours, days, weeks (-. If I find something I will post it.
If anybody else would have a clew, feel free to share

**Comment by codetheweb** [comment]
(I'm copy/pasting this into every open issue and PR.)

This plugin is now deprecated, as I don't have enough time to maintain it along with other TuyAPI related projects. Please use AMoo-Miki's [homebridge-tuya-lan](https://www.npmjs.com/package/homebridge-tuya-lan) plugin instead. (Or, you can continue to use this plugin, but I will not be giving support or adding any new devices.)

I'm sorry about this, but this plugin is taking a disproportionate amount of my time that I believe is better spent making TuyAPI more stable and adding more tools to the ecosystem.

**Comment by iRayanKhan** [comment]
Closing; inactive thread. If you need support please re-open this issue.
